{"$schema":"https://momi.local/schemas/debt-lifecycle-registry-v1.schema.json","schema_version":1,"authority":{"decision":"M169-DEBT-014","decision_id":"e39f17af-e5c0-4441-89a0-6ff417e57c91","accepted_event":"063a3b83-3168-4891-a433-7c0f5ba808b1","content_digest":"ade77d7485e290596457564a9c1d168bdbbf63bc75b740edd119108a33cd8dcd"},"policy":{"as_of":"2026-08-18","review_max_days":30,"expiry_max_days":90,"unrelated_remote_result":"not_applicable_success","unknown_remote_result":"indeterminate_failure","issue_closure":"deliberate_owner_action_only"},"records":[{"remediation_issue":194,"accountable_owner":"Zac","risk":"high","temporary_reason":"POS and warehouse access remains temporary until exact dataset owners replace private cross-service access.","introduced_on":"2026-07-18","reviewed_on":"2026-08-18","next_review_on":"2026-09-17","expires_on":"2026-11-16","removal_evidence":"Remove each fingerprint with its owning POS or warehouse contract-cutover PR and focused access proof.","reviews":[{"reviewed_on":"2026-08-18","reviewer":"Zac","decision":"accept","rationale":"Accepted under M169-DEBT-014 after exact inventory and focused issue ownership review."}],"fingerprints":["sha256:023d46fea0f117b4569efd941670b013630011cfaf1d79ebd1642d0ad7a789e4","sha256:029e81ce343fd3419c41d992f0c9bd0bcf8f50e2e9659a18fba45787619db579","sha256:05eaa335793803fa60f0f6350d74d0018a1a258cce3747bcd1bcfbbde15c7dc0","sha256:089c9088a6f6f456c506e765f1f73f67c1584d811a17239fb6b00d385df7113d","sha256:1537c1aa6250192fc6823d54b09b3738ad8828fccb94a5f74fd9a925c013d5aa","sha256:1abd61653b875f377796b66aa2906780390a80c0cadc185232bc181a8c2fe7d3","sha256:1b056c01917a5a669c5a24742c9058733f39f1ee4e29c28b575eb14e5b42d8d3","sha256:1c25514baf77b8881d1b3116caf206b4c00137db5c33074eb378b426c5ff5312","sha256:20395e516f8f2fc452eb8ecbd53d7bf6b0c05603d30efa07842d38662167ab82","sha256:2c1f5f52024434cb92d1cfe7f484512b67513af5df5510bad2c9aecc6a482d22","sha256:2c3d43f9b346b47903ca68cd3d7706fd333533b066e717d377924ef0022ac29c","sha256:30ada220ea96d23cfaac01ac31c5744a9e9ae45b4a2a140cf388a954281aa87f","sha256:326274055ebc1033a521c9f1eb547f5c6d883922c709bc2edd061e02a68e9ce8","sha256:35edb77729bdad544b8a2b5d7f2b052df32bd5d1db5c0261e90ed2ee2e5c9c09","sha256:36a87dccf7dbf6ff31d8f16e5db0423cf19b8b1a6a55e5444841241b22a0e0d3","sha256:3d02cf5a9d73cfb119c07037259a02c51b0efa236e37cfd994560a7d2600d606","sha256:3fd529940d6b31ff308dbe63055c1a50d4af3d739cf1fae5a64a1649b9b666d8","sha256:51452bb771456ae51d17a3bbf053e561a0b2842cd94bcdebbd250b6fb44a5f71","sha256:5307d83161118152755cba12fb71a815c06357b175ce344efd00fe2381317cc3","sha256:53f47650fd21d99bb500343e413e37b2856f2aaa6e802cb91500d55c0b3c111a","sha256:5b461b2e5080b5a7a0fc85dc1e92bcb48735a4bde2b4368ab7c35db34415bdf1","sha256:5b794d867ce20e71c5dbe0010d427336c8807f80ec3723b16a23b0a154ccce90","sha256:5da0eb6f27c3b2ed9fafd568dbb9cff727a3e5edc50b2a85acf58ea99d6ffe07","sha256:5feb227661735ff9764ca67ab96ab3a7717c4df87a7fbcd9307f9a76b79ce39d","sha256:60a27c9c89852ad777141bf43864f95efa3ae8294cd3ac651e7e0e5eaddc04d3","sha256:628cbf020785cf3649d897ef19aa9dc897457bb4cc8fa05999c95c63fc9f08d4","sha256:7abd82ff7ab92c3e56a14f74da1bcc3f6398c864d993c51d36073f076d2a1532","sha256:7c29f5670885c0a27593d1b6375da6b4582d66d289c37ce062da690d24075f7c","sha256:7efee4416d0f61ac99c3b00c365550d03ae4f4e315b17b4224829565a80db14f","sha256:895e57317170a5792fce2e4e62861dfdcf660c4ce4e9f25097068e89b5940d06","sha256:8d849947993d82cea0a5ca83ee4d2967359f56268800a6c45cd85d6138ad14b4","sha256:90fbd9b41ff5b994e8eb0f17e1ec0076173dcf728fe19ee858b6739a5f3e2d94","sha256:9f0fe6cfadbe9e65935fca75a6824c5f74ad3518de6d75478397e776b3f49063","sha256:a192dbd17fa9c62d3ce4bd4673aa6912cb821df25858b263c4dbe335f3e6b699","sha256:a5e30025c082374fe863a509dc2eab49c76e2d9404364cce6afdfb8fb6969f24","sha256:af62df77502ec1048f9bbdd06b205853a379ac8870791d6760c5aaddfd67b622","sha256:b0d8ea88683c87f52cfd392bdaa8a6f5d537bc0c08dd0913415c79d5c82e7f83","sha256:b36aea1e294191a1d1571c4074ae3f9fd2da4fb731c6d9bffa91f01e73a62a55","sha256:b472436800450c0845ed187ea4bd8a7efa5fa7a3dad9f87da7381095c65652d3","sha256:bb43433c34bdae0966c568fd25619f73005b880f9aa989d1e4ca1fdb5b30cbf9","sha256:bc3707ba9783638c8a39696633d7943384de2d0a674eff8d428d0699233475b4","sha256:c1017d9df2c037aa3e27f7a1cb0bedc137c95f9439d83cb831e5831856da11d1","sha256:c1be8315fec00926bbea820498223186dae079d94d4b64e4f178165833121ec5","sha256:cc3325b5838e0622f2ef1bef4eaf4700cd3f9ba55f4b7b551238c389cdd017f1","sha256:ccacd98d073c17acc7685f407359a3ce7c0e78fe82a13a6ffbe893af2bb33c99","sha256:d1de53a03ef07f7b719e21c2b9843e89434ef7cba8721a342ef271be9d6f84d4","sha256:d271a1907991ce64dc7ebe107887b81bd10d3543504377cbfaedff260cfe66db","sha256:d30dd8374575f273e91569621c1521149ea551376b479f02a37e03abb97c4546","sha256:d48992ed1fc50d9488b8412d1533928b8e0448deef0c46429bef66961b0b3ecd","sha256:d4aaeaa2ab66c424ee9b92e92fcd966deb4f412002f50d3c6f98cf97e1b55ff0","sha256:dc16e01a65e4f6fa09c7ab002e57580ba35ac60ff25f663e2afba6f09d8fd37d","sha256:df0086590fccd20f737ff5a5958eb98c948982c18fa729067cd1392f633a2266","sha256:e4d9bf133ebfa76761897d6e6f36221f75f79dc7196ea3289c3e3b4c0bf8ccdc","sha256:e6f091e46a769b97e9b50d78444e59f9cc46f7b155a09363a801eec43377ab87","sha256:e8813592d821bba0d651bb2f68b4d1b6700f2af2737e51c4d98edb1eb96dc680","sha256:f1118be01625515e3fc95e1d7637302e9f2a08051776c0ed7ba76937d201cfa0","sha256:f53ad9c3529bbd4a0c7995df733a255504185fb2240a458e2d236b53623d15b5","sha256:f64d151796b728103e0e8e6ee6c94dd371d072cd3b494fe190cdc65486113627","sha256:fb1497d14678bc08b3c0acffff4ce489622c19a65bd087cc0f6956a4abe3733a","sha256:fc97a449e359076b996aa44c214287226cdafe3049c8a6eb39c2277dca97110a","sha256:fdfcb32b25506a6c1460599d7b6898c777310cab0174441ba11350b13f1f1339"]},{"remediation_issue":195,"accountable_owner":"Zac","risk":"high","temporary_reason":"Alerting and Slack delivery access remains temporary until decision and delivery owners expose exact contracts.","introduced_on":"2026-07-18","reviewed_on":"2026-08-18","next_review_on":"2026-09-17","expires_on":"2026-11-16","removal_evidence":"Remove each fingerprint with its alerting or Slack contract-cutover PR and focused access proof.","reviews":[{"reviewed_on":"2026-08-18","reviewer":"Zac","decision":"accept","rationale":"Accepted under M169-DEBT-014 after exact inventory and focused issue ownership review."}],"fingerprints":["sha256:052915818a4f68b83c52d8f1e798735268f661ecbc36a1c40d62776d089b1b96","sha256:0b68ac92248aebe8add640c5fa4dce633fed17011243c55b408b31efe9c932ff","sha256:1344202302c63e4f0aee509bfa3bee1037af5292032add4397f137a0288aad8b","sha256:1d6e967cf6a3b971f830467c34e37e158bb089383a7b0cb00600a03957626613","sha256:1f8b4ecca57f3273dadc9659b7d294a496d1eadc9a09fb25849e79c18f26f79b","sha256:20cf0664306677bb639deb5e804dbfbcb4b82afcd79b660c55566a7381edfcde","sha256:2cf7b09295e61df5c6208b87f8a9c22bbfe13db243b23a9c9c3558d766ad3202","sha256:4f773697698d64c71deb7e0a1027c3ecab5cacd5f94fb5fe47c32c7727694ce4","sha256:507ef85a372d71aae885ea55e52f4271ba26621eda7662fdf1461fd81d11e90f","sha256:676032634bab3298a791a6187e2539554e25bcbf3ff95d658d5037b24cfb7603","sha256:69d2b9d2f35291d118b886382386d494cbf4d52cd935827d6e595da8ae1a748a","sha256:77e1f1f8322ac3407b4ef3b8f20c8b8c14d6436142ba9ffb8187e1b975bea248","sha256:7e3f21c0b5c2034228fe4f8dbb82d1270d5283f3c7a559a41db2bd12fbef4017","sha256:8c30f660be971f8430eb1a2766dac7ac14d9f4ab503277040b2d09d1bce65f5e","sha256:902f18bb13521494efb8af3a984942c4bb832cd408f9e8be4d0b08257f42929e","sha256:92f37862744fe861d8779e96a7982cea20cda393fc40eabbf4c5a8af6fe92ef3","sha256:9363e0b731f238c97f13f5f9091d57376b172f8bda5f101bd5a7ef6e7dcc7c7c","sha256:a2fe9e59cda400d63d308f919d6da52b729824912b21e1a85cb9ad2c6a789c05","sha256:b4df3d82b24cce15d4db893d0cf956b58818f476ab63e6a7eb1e6b3df86da9eb","sha256:ca851538b74b96daef7bee22eb08196ec219c689271d1ff296ba2f48546e65ae","sha256:cbc57813e81a26db65c5ed7a06fd03aad737867b07511a612b9001e10ed677b6","sha256:ddcb3c1380664ced52fc3eccea9528f97232887a1a033b1de7cf01b9b2269137","sha256:e8f2b38c88970a40a8e77dd0b9e053f365714a04093c6fae53f826a11211d0d2"]},{"remediation_issue":196,"accountable_owner":"Zac","risk":"high","temporary_reason":"Runtime-registry and event-router access remains temporary until consumers use narrow owner contracts.","introduced_on":"2026-07-18","reviewed_on":"2026-08-18","next_review_on":"2026-09-17","expires_on":"2026-11-16","removal_evidence":"Remove each fingerprint with its runtime or event owner-contract PR and focused access proof.","reviews":[{"reviewed_on":"2026-08-18","reviewer":"Zac","decision":"accept","rationale":"Accepted under M169-DEBT-014 after exact inventory and focused issue ownership review."}],"fingerprints":["sha256:061ab87a470ca6441c01ecd8e74de782fa1c3797169f14497fd03f447163834b","sha256:3e000bd8611227c83d9c9739d3ebab48bc514d8f9027eebd800ba18bc4c99f33","sha256:4333db468efbb05539a0aa2cc793257acc6b5623f6e70fc8389ebd8828ddf426","sha256:496e0e7dc9c46fe33eca0e88033c943c230e3d4b4dcc86ab1a6b1439215027d0","sha256:4b0241d8f448da563a65e347b8eb5ade29ecc2745b5017b9efa4ad4b1a1c1c91","sha256:51196ed750600fa97fbf6fbcd3f27c32d22da9f325a8c9da1c7c7b7298ddf8a9","sha256:599e583a358067a25d35cbb0d2a27faba1cb47796044e1f7e93789257582a44a","sha256:5d5e07c0ed09d1b3d9b0dd3464967020b86bebcea232e15e402923c10978f483","sha256:ccf7b66c847cfb2c7810ffd01d62dbd2048ce09c33afae1617c73cae43b71b88","sha256:d32c2a4199b3b32d392a48de659b6f6220c149287e02648e3bcd982192119403"]},{"remediation_issue":572,"accountable_owner":"Zac","risk":"high","temporary_reason":"Archive and evaluation access remains temporary until the three exact private accesses use owner contracts.","introduced_on":"2026-07-18","reviewed_on":"2026-08-18","next_review_on":"2026-09-17","expires_on":"2026-11-16","removal_evidence":"Remove only with the archive/evaluation owner-contract cutover and exact evidence required by issue #572.","reviews":[{"reviewed_on":"2026-08-18","reviewer":"Zac","decision":"accept","rationale":"Accepted under M169-DEBT-014 after exact inventory and focused issue ownership review."}],"fin